{"$schema": "../schemas/candidate.schema.json", "candidate_id": "candidate-us-2026-09-01-portable-neck-fan", "product_name": "Portable Neck Fan — Hands-Free Wearable Cooling Device", "market_config_id": "us-pilot", "status": "VALIDATION_READY", "created_at": "2026-09-01T14:41:09.933861+00:00", "created_by": "dropship-research", "source_summary": "Ingested from candidate-us-2026-09-01-portable-neck-fan.md by ScoutBot", "competitor_evidence": [{"source_url": "https://meta.com/ads/library", "competitor_name": "Market Competitor Sample", "product_url": "https://example.com/competitor", "observed_price": 39.99, "currency": "USD", "extraction_method": "scout_bot_scan", "confidence": "medium"}], "supplier_evidence": [{"supplier_name": "CJ Dropshipping Domestic", "product_url": "https://cjdropshipping.com/product", "quoted_product_cost": 9.43, "quoted_shipping_cost": 5.07, "warehouse_country": "CN", "delivery_days_min": 3, "delivery_days_max": 7, "hs_code": "UNVERIFIED", "origin_country": "CN", "landed_cost_confidence": "medium"}], "demand_evidence": [{"source": "social_trend_scan", "signal_type": "video", "metric_name": "social_views", "metric_value": 1500000, "confidence": "high"}, {"source": "demand_screen.py", "signal_type": "review", "metric_name": "skeptic_ratio", "metric_value": 0.22, "confidence": "medium"}], "unit_economics": {"gross_selling_price": 39.99, "currency": "USD", "sales_tax_liability": 0.0, "discounts": 0.0, "refund_allowance": 1.6, "net_revenue": 38.39, "product_cost": 9.43, "shipping_cost": 5.07, "duty": 0.0, "payment_fees": 1.2, "packaging_cost": 1.0, "variable_support_cost": 0.8, "return_allowance": 1.2, "contribution_before_ads": 21.34, "break_even_cpa": 21.34, "target_cpa": 14.94, "safety_factor": 0.7, "expected_profit_per_order": 6.4}, "compliance_unknowns": ["Non-domestic fulfillment (De Minimis customs duty & carrier clearance risk)"], "recommendation": "founder_review", "rationale": "AnalystBot Profit Score: 70.7/100. Net Margin: $21.34, COGS Multiple: 1.47x, CAC Buffer: 1.78x CPA.", "approval_gate": {"requires_ahmad_approval": true, "blocked_live_actions": ["ad_spend", "supplier_order_submission", "public_storefront_publish", "customer_messaging", "price_change", "new_country_launch"]}}