{"$schema": "../schemas/candidate.schema.json", "candidate_id": "bamboo-drawer-organizers", "product_name": "Bamboo Drawer Organizers (modular, expandable, compartmentalized)", "market_config_id": "eu-de", "status": "VALIDATION_READY", "created_at": "2026-09-01T02:53:14.329611+00:00", "created_by": "dropship-research", "source_summary": "Ingested from bamboo-drawer-organizers.md by ScoutBot", "competitor_evidence": [{"source_url": "https://meta.com/ads/library", "competitor_name": "Market Competitor Sample", "product_url": "https://example.com/competitor", "observed_price": 69.9, "currency": "EUR", "extraction_method": "scout_bot_scan", "confidence": "medium"}], "supplier_evidence": [{"supplier_name": "CJ Dropshipping Domestic", "product_url": "https://cjdropshipping.com/product", "quoted_product_cost": 17.48, "quoted_shipping_cost": 4.5, "warehouse_country": "CN", "delivery_days_min": 3, "delivery_days_max": 7, "hs_code": "UNVERIFIED", "origin_country": "CN", "landed_cost_confidence": "medium"}], "demand_evidence": [{"source": "social_trend_scan", "signal_type": "video", "metric_name": "social_views", "metric_value": 1500000, "confidence": "high"}, {"source": "demand_screen.py", "signal_type": "review", "metric_name": "skeptic_ratio", "metric_value": 0.22, "confidence": "medium"}], "unit_economics": {"gross_selling_price": 69.9, "currency": "EUR", "sales_tax_liability": 0.0, "discounts": 0.0, "refund_allowance": 2.8, "net_revenue": 67.1, "product_cost": 17.48, "shipping_cost": 4.5, "duty": 0.0, "payment_fees": 2.1, "packaging_cost": 1.0, "variable_support_cost": 0.8, "return_allowance": 1.2, "contribution_before_ads": 40.02, "break_even_cpa": 40.02, "target_cpa": 28.01, "safety_factor": 0.7, "expected_profit_per_order": 12.01}, "compliance_unknowns": ["Non-domestic fulfillment (De Minimis customs duty & carrier clearance risk)"], "recommendation": "founder_review", "rationale": "AnalystBot Profit Score: 83.7/100. Net Margin: $40.02, COGS Multiple: 1.82x, CAC Buffer: 1.86x CPA.", "approval_gate": {"requires_ahmad_approval": true, "blocked_live_actions": ["ad_spend", "supplier_order_submission", "public_storefront_publish", "customer_messaging", "price_change", "new_country_launch"]}}