{"$schema": "../schemas/candidate.schema.json", "candidate_id": "cand-cj-sku-magnetic-wristband-pro", "product_name": "Magnetic Tool Wristband with 15 Strong Magnets", "market_config_id": "us-pilot", "status": "REJECTED", "created_at": "2026-09-01T03:06:48.960730+00:00", "created_by": "dropship-research", "source_summary": "Discovered via CJ Dropshipping catalog search: CJ-SKU-MAGNETIC-WRISTBAND-PRO", "competitor_evidence": [{"source_url": "https://amazon.com/dp/sample", "competitor_name": "Market Benchmarks", "product_url": "https://amazon.com/dp/sample", "observed_price": 22.99, "currency": "USD", "extraction_method": "catalog_screen", "confidence": "high"}], "supplier_evidence": [{"supplier_name": "CJ Dropshipping US Domestic Hub", "product_url": "https://cjdropshipping.com/product/CJ-SKU-MAGNETIC-WRISTBAND-PRO", "quoted_product_cost": 4.2, "quoted_shipping_cost": 3.8, "warehouse_country": "US", "delivery_days_min": 3, "delivery_days_max": 6, "hs_code": "392690", "origin_country": "CN", "landed_cost_confidence": "high"}], "demand_evidence": [{"source": "social_scan", "signal_type": "video", "metric_name": "views", "metric_value": 850000, "confidence": "high"}, {"source": "demand_screen", "signal_type": "review", "metric_name": "skeptic_ratio", "metric_value": 0.22, "confidence": "high"}], "unit_economics": {"gross_selling_price": 22.99, "currency": "USD", "sales_tax_liability": 0.0, "discounts": 0.0, "refund_allowance": 0.92, "net_revenue": 22.07, "product_cost": 4.2, "shipping_cost": 3.8, "duty": 0.0, "payment_fees": 0.69, "packaging_cost": 1.0, "variable_support_cost": 0.8, "return_allowance": 1.2, "contribution_before_ads": 10.38, "break_even_cpa": 10.38, "target_cpa": 7.27, "safety_factor": 0.7, "expected_profit_per_order": 3.11}, "compliance_unknowns": [], "recommendation": "reject", "rationale": "AnalystBot Profit Score: 38.2/100. Net Margin: $10.38, COGS Multiple: 1.3x, CAC Buffer: 0.87x CPA.", "approval_gate": {"requires_ahmad_approval": true, "blocked_live_actions": ["ad_spend", "supplier_order_submission", "public_storefront_publish", "customer_messaging", "price_change", "new_country_launch"]}}