{"$schema": "../schemas/candidate.schema.json", "candidate_id": "candidate-us-2026-09-01-magnetic-cable-organizer", "product_name": "Magnetic Cable Organizer — 6-Pack Silicone Cord Clips", "market_config_id": "us-pilot", "status": "FOUNDER_REVIEW", "created_at": "2026-09-01T14:41:09.550241+00:00", "created_by": "dropship-research", "source_summary": "Ingested from candidate-us-2026-09-01-magnetic-cable-organizer.md by ScoutBot", "competitor_evidence": [{"source_url": "https://meta.com/ads/library", "competitor_name": "Market Competitor Sample", "product_url": "https://example.com/competitor", "observed_price": 24.99, "currency": "USD", "extraction_method": "scout_bot_scan", "confidence": "medium"}], "supplier_evidence": [{"supplier_name": "CJ Dropshipping Domestic", "product_url": "https://cjdropshipping.com/product", "quoted_product_cost": 4.42, "quoted_shipping_cost": 2.38, "warehouse_country": "US", "delivery_days_min": 3, "delivery_days_max": 7, "hs_code": "UNVERIFIED", "origin_country": "CN", "landed_cost_confidence": "medium"}], "demand_evidence": [{"source": "social_trend_scan", "signal_type": "video", "metric_name": "social_views", "metric_value": 1500000, "confidence": "high"}, {"source": "demand_screen.py", "signal_type": "review", "metric_name": "skeptic_ratio", "metric_value": 0.22, "confidence": "medium"}], "unit_economics": {"gross_selling_price": 24.99, "currency": "USD", "sales_tax_liability": 0.0, "discounts": 0.0, "refund_allowance": 1.0, "net_revenue": 23.99, "product_cost": 4.5, "shipping_cost": 2.3, "duty": 0.0, "payment_fees": 1.02, "packaging_cost": 1.0, "variable_support_cost": 0.8, "return_allowance": 1.2, "contribution_before_ads": 13.17, "break_even_cpa": 13.17, "target_cpa": 9.22, "safety_factor": 0.7, "expected_profit_per_order": 3.95}, "compliance_unknowns": [], "recommendation": "founder_review", "rationale": "Corrected 2026-09-03: retail was a $69.99 placeholder; docs/candidates/candidate-us-2026-09-01-magnetic-cable-organizer.md records the researched retail as $24.99. payment_fees recalculated at 2.9%+$0.30 for the corrected price (was sized for $69.99). expected_profit_per_order now correctly subtracts target_cpa from contribution (previous record set it equal to contribution, a 3.3x overstatement). At $24.99: contribution $13.17, COGS multiple 1.94x. FAILS the CAC gate at both median CPA candidates in circulation ($8.50 gate=$17.00, $12.00 gate=$24.00) \u2014 median CPA is itself an open founder decision. Does not clear MIN_COGS_MULTIPLE=2.00x either. See reports/2026-09-02-founder-decision-matrix.md \u00a73 for the original finding.", "approval_gate": {"requires_ahmad_approval": true, "blocked_live_actions": ["ad_spend", "supplier_order_submission", "public_storefront_publish", "customer_messaging", "price_change", "new_country_launch"]}}