{"$schema": "../schemas/candidate.schema.json", "candidate_id": "cand-cj-sku-magnetic-cord-6p", "product_name": "Magnetic Cable Organizer 6-Pack Desk Clips", "market_config_id": "us-pilot", "status": "VALIDATION_READY", "created_at": "2026-09-01T03:06:48.656545+00:00", "created_by": "dropship-research", "source_summary": "Discovered via CJ Dropshipping catalog search: CJ-SKU-MAGNETIC-CORD-6P", "competitor_evidence": [{"source_url": "https://www.facebook.com/ads/library/?id=dsa-ad-001", "competitor_name": "TidyDesk Official DE", "product_url": null, "observed_price": 69.9, "currency": "EUR", "extraction_method": "meta-ad-library-dsa-api", "confidence": "high"}, {"source_url": "https://www.facebook.com/ads/library/?id=dsa-ad-002", "competitor_name": "Nordic Desk Space", "product_url": null, "observed_price": 74.95, "currency": "EUR", "extraction_method": "meta-ad-library-dsa-api", "confidence": "high"}, {"source_url": "https://www.facebook.com/ads/library/?id=dsa-ad-003", "competitor_name": "Euro Tech Gear", "product_url": null, "observed_price": 48.0, "currency": "EUR", "extraction_method": "meta-ad-library-dsa-api", "confidence": "high"}, {"source_url": "https://www.facebook.com/ads/library/?id=dsa-ad-004", "competitor_name": "Berlin Office Design", "product_url": null, "observed_price": 68.0, "currency": "EUR", "extraction_method": "meta-ad-library-dsa-api", "confidence": "low"}, {"source_url": "https://www.facebook.com/ads/library/?id=dsa-ad-005", "competitor_name": "Workspace Essentials FR", "product_url": null, "observed_price": 72.5, "currency": "EUR", "extraction_method": "meta-ad-library-dsa-api", "confidence": "low"}, {"source_url": "https://www.facebook.com/ads/library/?id=dsa-ad-006", "competitor_name": "Amsterdam Cable Hub", "product_url": null, "observed_price": 69.0, "currency": "EUR", "extraction_method": "meta-ad-library-dsa-api", "confidence": "high"}], "supplier_evidence": [{"supplier_name": "CJ Dropshipping US Domestic Hub", "product_url": "https://cjdropshipping.com/product/CJ-SKU-MAGNETIC-CORD-6P", "quoted_product_cost": 3.8, "quoted_shipping_cost": 3.2, "warehouse_country": "US", "delivery_days_min": 3, "delivery_days_max": 6, "hs_code": "392690", "origin_country": "CN", "landed_cost_confidence": "high"}], "demand_evidence": [{"source": "social_scan", "signal_type": "video", "metric_name": "views", "metric_value": 2100000, "confidence": "high"}, {"source": "demand_screen", "signal_type": "review", "metric_name": "skeptic_ratio", "metric_value": 0.14, "confidence": "high"}], "unit_economics": {"gross_selling_price": 62.99, "currency": "USD", "sales_tax_liability": 0.0, "discounts": 0.0, "refund_allowance": 1.0, "net_revenue": 23.99, "product_cost": 3.8, "shipping_cost": 3.2, "duty": 0.0, "payment_fees": 0.75, "packaging_cost": 1.0, "variable_support_cost": 0.8, "return_allowance": 1.2, "contribution_before_ads": 54.1, "break_even_cpa": 13.24, "target_cpa": 9.27, "safety_factor": 0.7, "expected_profit_per_order": 54.1}, "compliance_unknowns": [], "recommendation": "founder_review", "rationale": "CJ Catalog item CJ-SKU-MAGNETIC-CORD-6P - Wow factor: Snap-in magnetic cable docking in 1 second", "approval_gate": {"requires_ahmad_approval": true, "blocked_live_actions": ["ad_spend", "supplier_order_submission", "public_storefront_publish", "customer_messaging", "price_change", "new_country_launch"]}}