{"$schema": "../schemas/candidate.schema.json", "candidate_id": "candidate-electric-jar-vacuum-sealer", "product_name": "Automatic Electric Mason Jar Vacuum Sealer Kit", "market_config_id": "eu-de", "status": "HOLD", "created_at": "2026-09-01T02:53:13.262479+00:00", "created_by": "dropship-research", "source_summary": "Ingested from candidate-electric-jar-vacuum-sealer.md by ScoutBot", "competitor_evidence": [{"source_url": "https://meta.com/ads/library", "competitor_name": "Market Competitor Sample", "product_url": "https://example.com/competitor", "observed_price": 74.9, "currency": "EUR", "extraction_method": "scout_bot_scan", "confidence": "medium"}], "supplier_evidence": [{"supplier_name": "CJ Dropshipping Domestic", "product_url": "https://cjdropshipping.com/product", "quoted_product_cost": 10.2, "quoted_shipping_cost": 4.8, "warehouse_country": "CN", "delivery_days_min": 3, "delivery_days_max": 7, "hs_code": "UNVERIFIED", "origin_country": "CN", "landed_cost_confidence": "medium"}], "demand_evidence": [{"source": "social_trend_scan", "signal_type": "video", "metric_name": "social_views", "metric_value": 1500000, "confidence": "high"}, {"source": "demand_screen.py", "signal_type": "review", "metric_name": "skeptic_ratio", "metric_value": 0.22, "confidence": "medium"}], "unit_economics": {"gross_selling_price": 74.9, "currency": "EUR", "sales_tax_liability": 0.0, "discounts": 0.0, "refund_allowance": 3.0, "net_revenue": 71.9, "product_cost": 10.2, "shipping_cost": 4.8, "duty": 0.0, "payment_fees": 2.25, "packaging_cost": 1.0, "variable_support_cost": 0.8, "return_allowance": 1.2, "contribution_before_ads": 51.65, "break_even_cpa": 51.65, "target_cpa": 36.15, "safety_factor": 0.7, "expected_profit_per_order": 15.5}, "compliance_unknowns": ["Non-domestic fulfillment (De Minimis customs duty & carrier clearance risk)", "Electronics / Battery component (WEEE / return hazard)"], "recommendation": "hold", "rationale": "Listing paused by Founder (SELL_KILL executed).", "approval_gate": {"requires_ahmad_approval": true, "blocked_live_actions": ["ad_spend", "supplier_order_submission", "public_storefront_publish", "customer_messaging", "price_change", "new_country_launch"]}}